{
 "last_checked": "2026-10-31T16:05:45Z",
 "sources": [
  "congress_gov",
  "federal_register",
  "legiscan"
 ],
 "run_ids": [
  "run-20261031-1605-3d82",
  "run-20261031-1605-e88f",
  "run-20261031-1605-9aef"
 ],
 "outcome": "ok",
 "last_change": "2026-10-31",
 "checked": {
  "s-2938-ai-risk-evaluation-act": "2026-10-31T16:05:45Z",
  "h-r-9925-frontier-act": "2026-10-31T16:05:45Z",
  "s-5061-secure-ai-development-act": "2026-10-31T16:05:45Z",
  "h-r-9914-s-5105-catsr": "2026-10-31T16:05:45Z",
  "h-r-9477-ai-incident-reporting-act": "2026-10-31T16:05:45Z",
  "h-r-9917-ai-kill-switch-act": "2026-10-31T16:05:45Z",
  "h-r-9965-atomic-act": "2026-10-31T16:05:45Z",
  "s-5493-h-r-10538-ban-artificial-superintelligence-act": "2026-10-31T16:05:45Z",
  "warner-schatz-kim-ai-risk-management-and-security-act": "2026-10-28T07:41:04Z",
  "s-5417-h-r-10567-ai-emergency-button-act": "2026-10-31T16:05:45Z",
  "gaaia-discussion-draft": "2026-10-28T07:41:04Z",
  "trump-america-ai-act-draft": "2026-10-28T07:41:04Z",
  "white-house-legislative-recommendations": "2026-10-28T07:41:04Z",
  "ai-regulator-act-bennet-welch-proposal": "2026-10-28T07:41:04Z",
  "american-ai-security-act-announced": "2026-10-28T07:41:04Z",
  "senate-commerce-draft-cruz-klobuchar-thune": "2026-10-28T07:41:04Z",
  "h-r-9363-ai-security-and-innovation-act": "2026-10-31T16:05:45Z",
  "s-1792-h-r-3460-ai-whistleblower-protection-act": "2026-10-31T16:05:45Z",
  "s-4656-military-ai-act": "2026-10-31T16:05:45Z",
  "h-r-10180-self-improving-ai-monitoring-act": "2026-10-31T16:05:45Z",
  "h-r-10189-defense-ai-reliability-act": "2026-10-31T16:05:45Z",
  "s-5541-cyber-and-ai-board-of-investigations": "2026-10-31T16:05:45Z",
  "s-5471-ai-systems-transparency-act": "2026-10-31T16:05:45Z",
  "h-r-10362-stop-rogue-ai-act": "2026-10-31T16:05:45Z",
  "liccardo-kiley-us-china-ai-safety-bill": "2026-10-28T07:41:04Z",
  "bis-framework-for-ai-diffusion-biden-era-interim-final-rule": "2026-10-28T07:41:04Z",
  "bis-final-rule-on-ai-chip-licensing-to-china-macau": "2026-10-28T07:41:04Z",
  "chip-security-act-h-r-3447-cotton-companion": "2026-10-31T16:05:45Z",
  "gain-ai-act-of-2025-s-3150": "2026-10-31T16:05:45Z",
  "bis-affiliates-rule": "2026-10-28T07:41:04Z",
  "1026-threshold-lineage-eo-14110": "2026-10-28T07:41:04Z",
  "ai-overwatch-act-fy27-ndaa": "2026-10-31T16:05:45Z",
  "ca-sb-53-tfaia": "2026-10-31T16:05:45Z",
  "ny-raise-act-ch-699-ch-96": "2026-10-31T16:05:45Z",
  "il-sb-315-p-a-104-0538": "2026-10-31T16:05:45Z",
  "ma-h-5576-s-3178": "2026-10-31T16:05:45Z",
  "mi-hb-4668": "2026-10-31T16:05:45Z",
  "nj-s-4446-a-5275": "2026-10-31T16:05:45Z",
  "il-hb-3506-2025": "2026-10-31T16:05:45Z",
  "il-sb-3444": "2026-10-31T16:05:45Z",
  "il-sb-3312": "2026-10-31T16:05:45Z",
  "il-hb-4705-sb-3261": "2026-10-31T16:05:45Z",
  "ri-s-358-h-5224": "2026-10-31T16:05:45Z",
  "ny-s-10373-verification": "2026-10-31T16:05:45Z",
  "ny-s-10456-minimum-standards": "2026-10-31T16:05:45Z",
  "pa-h-b-2800-ai-risk-prevention-act": "2026-10-31T16:05:45Z",
  "mn-hf-4532-no-threshold": "2026-10-31T16:05:45Z",
  "ca-ab-1405-auditor-registry": "2026-10-31T16:05:45Z",
  "ca-sb-813-ivos": "2026-10-31T16:05:45Z",
  "oh-hb-628": "2026-10-31T16:05:45Z",
  "va-ch-425-426-jcots-study": "2026-10-31T16:05:45Z",
  "ct-p-a-26-15-ivo-pilot": "2026-10-31T16:05:45Z",
  "ct-p-a-26-15-omnibus": "2026-10-31T16:05:45Z",
  "s-5576-warner-schatz-kim-ai-risk-management-and-security-act": "2026-10-31T16:05:45Z",
  "s-5601-insider-threat-reporting-act": "2026-10-31T16:05:45Z",
  "h-r-3919-advanced-ai-security-readiness-act": "2026-10-31T16:05:45Z",
  "h-r-10873-ai-cyber-defense-act": "2026-10-31T16:05:45Z",
  "pa-h-r-637-frontier-ai-resolution": "2026-10-31T16:05:45Z",
  "fl-anthropic-v-department-of-war-n-d-cal": "2026-10-31T16:05:45Z",
  "protect-democracy-v-oncd": "2026-10-31T16:05:45Z",
  "x-ai-v-weiser-d-colo": "2026-10-31T16:05:45Z",
  "s-2604": "2026-10-31T16:05:45Z"
 }
}